question,contexts,answer,ground_truths
When was the first super bowl?,"['The Super Bowl....season since 1966,', 'replacing the NFL...in February.']","The first superbowl was held on January 15, 1967","['The first superbowl was held on January 15, 1967.']"
What were some important historical events that happened in Boston in 1919?,"['Boston Molasses Disaster, Police strike of 1919, and Victory Parade of 101st Infantry Regiment.']","In 1919, Boston saw the Molasses Disaster, a major police strike, and the Victory Parade of the 101st Infantry Regiment.","['Boston’s key 1919 events included the Molasses Disaster, the police strike, and the post-war Victory Parade.']"
Find drawings included on grave markers from people who died in the late 1700s.,['In memory of Capt. Thomas Eaton; Loae Parker; Mr. Nathaniel Bachelor.'],"There are gravestone rubbings with drawings from the late 1700s, such as those of Capt. Thomas Eaton.","['The collection includes gravestone drawings and rubbings from the 18th century, including Capt. Eaton and Loae Parker.']"
In which year did the Boston Marathon bombings occur?,"['The Boston Marathon bombings occurred on April 15, 2013, near the finish line of the annual marathon.', 'The attack killed three people and injured hundreds, leading to a large-scale manhunt across the Boston area.']",The Boston Marathon bombings took place in 2013.,['The Boston Marathon bombings happened in 2013.']
"Who has the concert called ""Eras Tour,"" and how many shows has she held?","[""Taylor Swift's Eras Tour is a global concert tour that began in March 2023 and spans multiple continents."", 'As of mid-2024, the Eras Tour has more than 150 scheduled shows across North America, South America, Europe, Asia, and Oceania.', 'The tour features performances of songs from all ten of Swift’s studio albums and has broken numerous box-office records.']","The Eras Tour is by Taylor Swift, and she has performed more than 150 shows around the world since 2023.","['Taylor Swift is the artist who has the concert called the Eras Tour, which includes about 150 shows worldwide between 2023 and 2024.']"
"What painting contains a girl who smiles, and from every angle she seems to be smiling at you?","['The Mona Lisa is a portrait painting by Leonardo da Vinci, created between 1503 and 1506.', 'It is famous for the subject’s enigmatic smile, which appears to change depending on the viewer’s angle.', 'The painting depicts Lisa Gherardini, the wife of Francesco del Giocondo, and is displayed in the Louvre Museum in Paris.']",The painting you are describing is the Mona Lisa by Leonardo da Vinci.,"['The painting that shows a woman who seems to smile from every angle is the Mona Lisa, painted by Leonardo da Vinci between 1503 and 1506.']"
